<?xml version="1.0" encoding="UTF-8"?>
<!-- XML Sample Message of message hierarchy                                          -->
<!-- Message:             ADC INV Transaction v1.0 Rev. 4                             -->
<!-- Transaction:         AA - Audit Data Collection Rev. 271                         -->
<!-- Datamodel:           Audit Data Collection Datamodel, version HEAD Rev. 347      -->
<!-- XML tagset used:     AdcsML                                                      -->
<!-- Generated at:        02-05-2021 16:07:32                                         -->
<!-- Generated using:     EC-Design 2.5.0 (http://www.ec-design.nl)                   -->
<!-- Generated by:        Jan Vrijenhoek (Digitect)                                   -->
<!-- Organisation:        Digitect B.V. (Digitect)                                    -->
<!-- NOTE:    This sample message was generated automatically: manual modifications will be lost -->
<AdcInvTransaction xsi:schemaLocation="http://schemas.iso.org/AdcsML/Messages/AdcInvTransaction-v1 AdcInvTransaction-v1.0.xsd"
		xmlns="http://schemas.iso.org/AdcsML/Messages/AdcInvTransaction-v1"
		xmlns:xsi="http://www.w3.org/2001/XMLSchema-instance">
	<InvTr>
		<TrDocId>TD001</TrDocId>
		<TrDocLnId>TD001.1</TrDocLnId>
		<ProjId>P001</ProjId>
		<TrOrdId>ORD001</TrOrdId>
		<TrOrdLnId>1</TrOrdLnId>
		<TrDt>2020-02-15</TrDt>
		<TrTm>15:30:00</TrTm>
		<TrTyp>Shipment</TrTyp>
		<TrTypSyst>SHPM</TrTypSyst>
		<TrDscr>Shipment of sand.</TrDscr>
		<TrQt>100.0000</TrQt>
		<SuplAcntId>S00001</SuplAcntId>
		<CustAcntId>C00001</CustAcntId>
		<InvDocId>123456789</InvDocId>
		<InvDocNr>123456789</InvDocNr>
		<InvDocLnId>1</InvDocLnId>
		<InvDocLnNr>1</InvDocLnNr>
		<Stat>NEW</Stat>
		<InvOrgCd>BS001</InvOrgCd>
		<InvStckUomCd>KG</InvStckUomCd>
		<InvCstngUomCd>KG</InvCstngUomCd>
		<InvPrdctId>PRD001</InvPrdctId>
		<LotNr>LOT1</LotNr>
		<SerialNr>SERIAL1</SerialNr>
		<InvRequiredBy>John Doe.</InvRequiredBy>
		<InvFromLctId>L001</InvFromLctId>
		<InvToLctId>L001</InvToLctId>
		<CostOrgCd>BS001</CostOrgCd>
		<InvCost>7000.0000</InvCost>
		<TrAdjCost>1000.0000</TrAdjCost>
		<FuncCurCd>USD</FuncCurCd>
		<InvSystOrExtSrc>I</InvSystOrExtSrc>
		<InvRcvdAndDispedCd>0</InvRcvdAndDispedCd>
		<GlLnDbAcntId>ACC123456789</GlLnDbAcntId>
		<GlLnCrAcntId>ACC123456789</GlLnCrAcntId>
		<Posted>
			<UserId>JD</UserId>
			<Dt>2020-03-02</Dt>
			<Tm>09:31</Tm>
		</Posted>
		<Crea>
			<UserId>JD</UserId>
			<Dt>2020-03-02</Dt>
			<Tm>09:31</Tm>
		</Crea>
		<Aprv>
			<UserId>JD</UserId>
			<Dt>2020-03-02</Dt>
			<Tm>09:31</Tm>
		</Aprv>
		<LstMdf>
			<UserId>JD</UserId>
			<Dt>2020-03-02</Dt>
			<Tm>09:31</Tm>
		</LstMdf>
		<BusSg>
			<BusSgCd>1234</BusSgCd>
		</BusSg>
	</InvTr>
</AdcInvTransaction>
